{
  "version": 1,
  "git_hash": "CP:727901",
  "issue": "327697",
  "patchset": "1",
  "key": {
    "arch": "x86",
    "branch": "some-branch-name",
    "config": "meta",
    "gpu": "GTX660",
    "model": "ShuttleA",
    "os": "Ubuntu12",
    "system": "UNIX"
  },
  "results": [
    {
      "key": {
        "test": "memory+usage_0_0",
        "sub_result": "max_rss_mb"
      },
      "measurement": 858
    },
    {
      "key": {
        "test": "DeferredSurfaceCopy_discardable_640_480",
        "source_type": "bench",
        "sub_result": "min+ms"
      },
      "measurements": {
        "config": [
          {
            "value": "8888",
            "measurement": 2.223606
          },
          {
            "value": "565",
            "measurement": 2.215988
          },
          {
            "value": "gpu",
            "measurement": 0.115713274509804
          }
        ]
      }
    }
  ],
  "links": {
    "link1": "www.google.com"
  }
}