{
  "version": 1,
  "git_hash": "fe4a4029a080bc955e9588d05a6cd9eb490845d4",
  "key": {
    "arch": "x86",
    "branch": "some-branch-name",
    "config": "meta",
    "gpu": "GTX660",
    "model": "ShuttleA",
    "os": "Ubuntu12",
    "system": "UNIX"
  },
  "results": [
    {
      "key": {
        "test": "memory_usage_0_0",
        "sub_result": "max_rss_mb"
      },
      "measurements": {
        "sub_result": {
          "max_rss_mb": 848,
          "min_rss_mb": 127
        }
      }
    },
    {
      "key": {
        "test": "DeferredSurfaceCopy_discardable_640_480",
        "source_type": "bench",
        "sub_result": "min_ms"
      },
      "measurements": {
        "config": {
          "8888": 2.223606,
          "565": 2.215988,
          "gpu": 0.115713274509804
        }
      }
    }
  ]
}
